file_name,text
k04/k04-039/k04-039-01.png,' Olimpia is watching us . The young man with her is
k04/k04-039/k04-039-02.png,"Orlando Cavalcanti , Francesco's friend . ' Orsini"
k04/k04-039/k04-039-03.png,shot an impatient glance at the couple . ' The young man
k04/k04-039/k04-039-04.png,"with the mole ? ' ' Yes , indeed . ' ' No matter . They are not"
k04/k04-039/k04-039-05.png,"looking at us . Now I must know , ' he whispered , ' what"
k04/k04-039/k04-039-06.png,"you meant , cara mia . Do you want your freedom in order"
k04/k04-039/k04-039-07.png,to marry ? '
k04/k04-050/k04-050-00.png,"Before replying to this , she glanced"
k04/k04-050/k04-050-01.png,"hastily around , then spoke in tones so low that he"
k04/k04-050/k04-050-02.png,had to bend his head to hear : ' I will never be
k04/k04-050/k04-050-03.png,any man's mistress . As to marrying again ...
k04/k04-050/k04-050-04.png,if I were free ... there is only one man I would
k04/k04-050/k04-050-05.png,"wish to marry ... but ... he , like myself , is now"
k04/k04-050/k04-050-06.png,bound . '
k04/k04-054/k04-054-00.png,With a swift gesture she closed her fan
k04/k04-054/k04-054-01.png,and moved away from him towards the group
k04/k04-054/k04-054-02.png,"in the centre of the gallery , leaving him standing"
k04/k04-054/k04-054-03.png,"alone , against that glowing , barbaric background ,"
k04/k04-054/k04-054-04.png,with a deeply thoughtful expression on his face .
k04/k04-054/k04-054-05.png,On a bright unclouded morning a few days after
k04/k04-054/k04-054-06.png,"the visit to the Doria Palace , the cardinal's"
k04/k04-054/k04-054-07.png,"coach left the villa , lurched over the unpaved"
k04/k04-054/k04-054-08.png,track and turned towards the ruined Baths
k04/k04-054/k04-054-09.png,of Diocletian .
k04/k04-057/k04-057-00.png,"Vittoria , accompanied by her maid , Lucia , was on her"
k04/k04-057/k04-057-01.png,"way to the Accoramboni villa , ostensibly to pay"
k04/k04-057/k04-057-02.png,"a daughterly call on her father , actually to coax"
k04/k04-057/k04-057-03.png,money from that indulgent parent to settle her mounting
k04/k04-057/k04-057-04.png,debts . Lucia was thinking how beautiful her mistress
k04/k04-057/k04-057-05.png,"looked , and how cunningly the olive-green dress"
k04/k04-057/k04-057-06.png,with its underskirt of rose-brocade fitted her
k04/k04-057/k04-057-07.png,perfect figure . Vittoria's thoughts were more complex .
k04/k04-061/k04-061-00.png,"The sparkling society of the Doria Palace , the flattery"
k04/k04-061/k04-061-01.png,"of Orsini's obsession , the thwarted ambitions of her"
k04/k04-061/k04-061-02.png,"restless spirit , all threw into sharp relief the contrast"
k04/k04-061/k04-061-03.png,of her grey life with the splendid one that filled
k04/k04-061/k04-061-04.png,"her dreams . At the Villa Montalto she felt an alien ,"
k04/k04-061/k04-061-05.png,and although she had repeatedly urged Francesco
k04/k04-061/k04-061-06.png,"to give her a separate establishment , he invariably"
k04/k04-061/k04-061-07.png,"pleaded his financial dependence on his uncle , who"
k04/k04-061/k04-061-08.png,had built the villa for his family .
k04/k04-064/k04-064-00.png,He reminded her that they must abide by Roman
k04/k04-064/k04-064-01.png,"custom , and dwell there with their relations . Her"
k04/k04-064/k04-064-02.png,values were those of the materialist who assesses
k04/k04-064/k04-064-03.png,"every human being in terms of fame , power and"
k04/k04-064/k04-064-04.png,"wealth . Francesco she despised for his dullness , his"
k04/k04-064/k04-064-05.png,"lack of initiative , his subservience to his uncle ."
k04/k04-068/k04-068-00.png,"Her husband's gentleness and amiability , his unselfish"
k04/k04-068/k04-068-01.png,"love for her , she regarded as signs of weakness . He was a"
k04/k04-068/k04-068-02.png,futile creature who had not even proved capable of giving
k04/k04-068/k04-068-03.png,her a child . Whatever passion she had experienced in the
k04/k04-068/k04-068-04.png,first months of marriage had been ousted by contempt .
k04/k04-068/k04-068-05.png,She had never loved him . Her thoughts rushed to Orsini .
k04/k04-068/k04-068-06.png,"Since the meeting in the Doria Palace , no word had"
k04/k04-068/k04-068-07.png,"come from him , and this silence oppressed her spirits"
k04/k04-068/k04-068-08.png,with a weight of misgiving .
k04/k04-075/k04-075-00.png,"She had , perhaps , demanded too much . The"
k04/k04-075/k04-075-01.png,kiss in the garden had plumbed unsus-
k04/k04-075/k04-075-02.png,"pected depths in her , and she knew that"
k04/k04-075/k04-075-03.png,"if she yielded to him , her passion could ,"
k04/k04-075/k04-075-04.png,"indeed , match his . Every instinct urged her to"
k04/k04-075/k04-075-05.png,"surrender , for there was that in his nature"
k04/k04-075/k04-075-06.png,to which her own had responded as it
k04/k04-075/k04-075-07.png,had responded to no other human being .
k04/k04-079/k04-079-00.png,"Prudence , ambition and reason had"
k04/k04-079/k04-079-01.png,"held instinct in check , and they must"
k04/k04-079/k04-079-02.png,dictate her course . There could be no
k04/k04-079/k04-079-03.png,compromise . For a brief interval
k04/k04-079/k04-079-04.png,she allowed herself the luxury of
k04/k04-079/k04-079-05.png,dreams . She began to imagine life at
k04/k04-079/k04-079-06.png,"Bracciano , the balls and fe*?5tes , the"
k04/k04-079/k04-079-07.png,conversation of poets and dilettanti . She
k04/k04-079/k04-079-08.png,visualized the pageantry of the tourna-
k04/k04-079/k04-079-09.png,"ment , and herself on the ducal dais beside"
k04/k04-079/k04-079-10.png,"Orsini , placing a chaplet of roses on the brows"
k04/k04-085/k04-085-00.png,This reverie was rudely ended as the coach gave a
k04/k04-085/k04-085-01.png,"sickening jolt and came to an abrupt stop , nearly throwing"
k04/k04-085/k04-085-02.png,the two girls from their seats . Lucia uttered a cry of
k04/k04-085/k04-085-03.png,"alarm . ' Look , madonna , we are surrounded ! ' It was true ."
k04/k04-085/k04-085-04.png,Men armed with pikes and daggers swarmed about
k04/k04-085/k04-085-05.png,"them and a lean , swarthy fellow was peering through"
k04/k04-085/k04-085-06.png,"the window , grinning impudently . ' Santa Maria ! '"
k04/k04-085/k04-085-07.png,shrieked Lucia . ' Banditti ! '
k04/k04-093/k04-093-00.png,Vittoria now realized that they were outside
k04/k04-093/k04-093-01.png,"Santa Maria degli Angeli , and that except for a few beggars"
k04/k04-093/k04-093-02.png,crouching in the doorway of the church and exhibiting
k04/k04-093/k04-093-03.png,"loathsome sores , the area was deserted . ' They are not banditti ,"
k04/k04-093/k04-093-04.png,"Lucia , ' said Vittoria , pointing to the badge on the man's"
k04/k04-093/k04-093-05.png,shoulder . The words were clear . ' Beware my hug ! ' Lucia
k04/k04-093/k04-093-06.png,stared speechlessly at the golden bear ; Vittoria swiftly
k04/k04-093/k04-093-07.png,averted her head to avoid the impertinent glance
k04/k04-093/k04-093-08.png,of the retainer .
k04/k04-099/k04-099-00.png,Her thoughts at this moment were chaotic . The
k04/k04-099/k04-099-01.png,"coach now turned in another direction , towards"
k04/k04-099/k04-099-02.png,the wild and desolate region behind the baths .
k04/k04-099/k04-099-03.png,"It was sparsely inhabited , dotted with fallow fields"
k04/k04-099/k04-099-04.png,"and terraced vineyards , and here and there jutted"
k04/k04-099/k04-099-05.png,"a brown outcrop of flower-wreathed ruins , a pathetic"
k04/k04-099/k04-099-06.png,reminder of Rome's former greatness .
k04/k04-103/k04-103-00.png,In this region of Monti most of the public baths
k04/k04-103/k04-103-01.png,"had been built in the time of the Caesars , but with the"
k04/k04-103/k04-103-02.png,breaking of the aqueducts during the barbarian invasions
k04/k04-103/k04-103-03.png,the baths had lost their purpose ; they had become
k04/k04-103/k04-103-04.png,stone quarries and their precious marble had been
k04/k04-103/k04-103-05.png,burnt for lime . Now escaped criminals and bandits
k04/k04-103/k04-103-06.png,"used these quarries as hiding places , to the danger"
k04/k04-103/k04-103-07.png,of travellers in the district .
k04/k04-106/k04-106-00.png,"As they lumbered past at a rattling pace , Vittoria"
k04/k04-106/k04-106-01.png,could see a wisp of smoke curling above the fire of a
k04/k04-106/k04-106-02.png,gypsy encampment and a few tatterdemalion creatures
k04/k04-106/k04-106-03.png,"gathered about it , cooking their frugal meal . These"
k04/k04-106/k04-106-04.png,were left far behind . An old man belabouring an
k04/k04-106/k04-106-05.png,"overladen donkey , and a withered crone appeared"
k04/k04-106/k04-106-06.png,"on the horizon , were overtaken and forgotten ."
k04/k04-110/k04-110-00.png,"Except for their escort , Vittoria and"
k04/k04-110/k04-110-01.png,Lucia might have been the only living
k04/k04-110/k04-110-02.png,creatures on an empty planet . After the
k04/k04-110/k04-110-03.png,"initial shock , Vittoria felt calm . She"
k04/k04-110/k04-110-04.png,"knew exactly what she wanted , and"
k04/k04-110/k04-110-05.png,"was prepared to take it without scruple ,"
k04/k04-110/k04-110-06.png,if she could . What she had forgotten
k04/k04-110/k04-110-07.png,in her self-absorption in her own schemes
k04/k04-110/k04-110-08.png,was that other people were equally absorbed
k04/k04-110/k04-110-09.png,"in their schemes , which were likely to"
k04/k04-110/k04-110-10.png,run counter to her own .
k04/k04-115/k04-115-00.png,This move today was a reminder of that fact .
k04/k04-115/k04-115-01.png,Whilst she automatically patted the hand of
k04/k04-115/k04-115-02.png,"the agitated Lucia , her brain was working"
k04/k04-115/k04-115-03.png,"rapidly , and she decided that she must be"
k04/k04-115/k04-115-04.png,"prepared to counter Orsini's demands ,"
k04/k04-115/k04-115-05.png,difficult though that would be . She became
k04/k04-115/k04-115-06.png,aware that the pace was slackening ;
k04/k04-115/k04-115-07.png,now the coach stopped .
k04/k04-119/k04-119-00.png,The moment had come . Upon the ensuing interview
k04/k04-119/k04-119-01.png,"the future would depend . Outwardly she was calm , but"
k04/k04-119/k04-119-02.png,"her heart was beating fast , and the palms of her"
k04/k04-119/k04-119-03.png,hands were damp . Orsini's high-crowned hat with
k04/k04-119/k04-119-04.png,its jaunty plume blotted out the light ; his hand
k04/k04-119/k04-119-05.png,was on the door . Glancing at Lucia he said in
k04/k04-119/k04-119-06.png,French to Vittoria : ' Your maid ... is she reliable ? '
k04/k04-126/k04-126-00.png,"She shrugged her shoulders , and replied in the same"
k04/k04-126/k04-126-01.png,language : ' Yes . But make it worth her while . '
k04/k04-126/k04-126-02.png,"' I see . I know how to deal with people like that , '"
k04/k04-126/k04-126-03.png,"and turning to the cowering Lucia , he spoke in her"
k04/k04-126/k04-126-04.png,"own language . ' Do you know who I am ? ' ' No ,"
k04/k04-126/k04-126-05.png,"signor , ' she whispered . ' I am the Orsini . My word is"
k04/k04-126/k04-126-06.png,law in Rome . '
k04/k04-136/k04-136-00.png,Lucia was regarding him as a rabbit looks at a stoat .
k04/k04-136/k04-136-01.png,"Thrusting his head farther into the coach , he said"
k04/k04-136/k04-136-02.png,sombrely : ' Have you ever heard of a punishment called
k04/k04-136/k04-136-03.png,the cord ? ' She blanched and shrank away . Was there not
k04/k04-136/k04-136-04.png,a street near Sant' Angelo called the Lane of the Corda
k04/k04-136/k04-136-05.png,"where criminals were hoisted by their wrists forty , fifty ,"
k04/k04-136/k04-136-06.png,"sixty feet into the air , and dropped again and again , until"
k04/k04-136/k04-136-07.png,their arms were wrenched from their sockets . ' You have
k04/k04-136/k04-136-08.png,heard of it ?
k04/k04-142/k04-142-00.png,The Orsini give that to traitors . There is
k04/k04-142/k04-142-01.png,no escaping the vengeance of an Orsini . We hunt
k04/k04-142/k04-142-02.png,"a traitor down to the ends of the earth , and no"
k04/k04-142/k04-142-03.png,power can save him ... or her . Do you understand ? '
k04/k04-142/k04-142-04.png,"' Yes , signor , ' she faltered . ' On the other hand , ' he"
k04/k04-142/k04-142-05.png,"continued , giving her a keen look , ' the Orsini are"
k04/k04-142/k04-142-06.png,generous to those who serve them faithfully .
k04/k04-149/k04-149-00.png,"Remember that , my girl . ' Lucia was beyond"
k04/k04-149/k04-149-01.png,"speech . He turned to Vittoria , sitting erect ,"
k04/k04-149/k04-149-02.png,with flushed cheeks and eyes sparkling with
k04/k04-149/k04-149-03.png,"anger . ' And now , madonna , ' he said smoothly , ' we will"
k04/k04-149/k04-149-04.png,continue the conversation started at the Doria
k04/k04-149/k04-149-05.png,"Palace . Be pleased to alight . ' ' I think , ' she replied"
k04/k04-149/k04-149-06.png,"coolly , ' I prefer to stay where I am . '"
k04/k04-156/k04-156-00.png,"' In that case , ' he reverted to French , ' I shall be obliged"
k04/k04-156/k04-156-01.png,"to lift you from the coach . ' Without answering him , she"
k04/k04-156/k04-156-02.png,"rose , and bending over the agitated girl , said softly :"
k04/k04-156/k04-156-03.png,"' No one will harm you , Lucia . Remain here . ' Ignoring his"
k04/k04-156/k04-156-04.png,"proffered hand , she stepped from the vehicle . ' Will you"
k04/k04-156/k04-156-05.png,be so good as to order your men not to molest my
k04/k04-156/k04-156-06.png,"maid , ' she said coldly to Orsini ."
k04/k04-163/k04-163-00.png,"' She is absolutely safe , ' he replied ; but he turned ,"
k04/k04-163/k04-163-01.png,"nevertheless , to the man who had peered into the"
k04/k04-163/k04-163-02.png,"coach , whom he had addressed as Luigi , and gave him sharp"
k04/k04-163/k04-163-03.png,"instructions on the matter . Vittoria stood looking about her ,"
k04/k04-163/k04-163-04.png,breathing the scent of thyme . The land at her feet sloped
k04/k04-163/k04-163-05.png,"away into a tiny valley beyond which , on the crest"
k04/k04-163/k04-163-06.png,"of a wooded hill-side , the ruins of a small temple"
k04/k04-163/k04-163-07.png,were etched against the clear blue of the sky .
k07/k07-059a/k07-059a-00.png,"He forgot time and place . He , the master , was gently"
k07/k07-059a/k07-059a-01.png,"led along erotic paths which he knew existed , but"
k07/k07-059a/k07-059a-02.png,had never trodden . He learned how to use his
k07/k07-059a/k07-059a-03.png,"hands , how to adore that body without haste , how"
k07/k07-059a/k07-059a-04.png,"to caress every inch with his mouth as well , to"
k07/k07-059a/k07-059a-05.png,creep down along her smooth muscles till he lost
k07/k07-059a/k07-059a-06.png,himself in a rapture of kisses in places he 'd
k07/k07-059a/k07-059a-07.png,"dreamed of , where life began to ooze and quickened"
k07/k07-059a/k07-059a-08.png,his heart beat to a thunder .
k07/k07-063a/k07-063a-00.png,"He looked at her . Head thrown back in a pool of hair ,"
k07/k07-063a/k07-063a-01.png,her blood-red lips parted and the beating of her
k07/k07-063a/k07-063a-02.png,heart in the full throat . Her mouth did things he
k07/k07-063a/k07-063a-03.png,thought no human being could stand without
k07/k07-063a/k07-063a-04.png,"dying , but he went on living in an ocean of"
k07/k07-063a/k07-063a-05.png,"voluptuousness , that swelled and ebbed over him ,"
k07/k07-063a/k07-063a-06.png,"under him , in him and through him ..."
k07/k07-067a/k07-067a-00.png,He was having a ball ! He twiddled the TV set with
k07/k07-067a/k07-067a-01.png,shaking hands . She sat calmly on the bed smoking
k07/k07-067a/k07-067a-02.png,a cigarette . His face was white with two red
k07/k07-067a/k07-067a-03.png,blotches . Hers was flushed and lovely . O.K. teacher !
k07/k07-067a/k07-067a-04.png,Was that any better ? You know it was ! You don't
k07/k07-067a/k07-067a-05.png,"need teaching , only a little coaxing ."
k07/k07-077/k07-077-00.png,He sat down and ran his finger down along her
k07/k07-077/k07-077-01.png,spine . Do you love me now ? Like yesterday ! I 'm
k07/k07-077/k07-077-02.png,extremely fond of you . The fact that you 're beginning
k07/k07-077/k07-077-03.png,to satisfy my physical wants does not change that .
k07/k07-077/k07-077-04.png,Before long you 'll give me the satisfaction that 'll set
k07/k07-077/k07-077-05.png,"me rocking on my feet , but I 'll still be only fond of"
k07/k07-077/k07-077-06.png,you . But you wouldn't marry me ?
k07/k07-085/k07-085-00.png,No . I 'm not your type . I 'd make you miserable . I
k07/k07-085/k07-085-01.png,mean that . I 'd very probably be unfaithful and
k07/k07-085/k07-085-02.png,"that 'd kill you . Then I 'd be unfaithful too , to teach"
k07/k07-085/k07-085-03.png,you a lesson . It wouldn't work . You 'd do it to
k07/k07-085/k07-085-04.png,spite me . I would never do it for that reason .
k07/k07-085/k07-085-05.png,To me it 'd be immaterial whether you 'd retaliate
k07/k07-085/k07-085-06.png,or not . You 'd go crazy if that situation arose .
k07/k07-122/k07-122-00.png,To observe the colour rise in her cheek
k07/k07-122/k07-122-01.png,"and hear her breath come faster , to see"
k07/k07-122/k07-122-02.png,the slight beads of sweat come out on
k07/k07-122/k07-122-03.png,her glistening skin and see her move
k07/k07-122/k07-122-04.png,with uncontrolled rhythm . To have her twist
k07/k07-122/k07-122-05.png,in an attempt to receive a caress he was
k07/k07-122/k07-122-06.png,"purposely withholding , to hear her deep-throated"
k07/k07-122/k07-122-07.png,moan of full satisfaction and feel her
k07/k07-122/k07-122-08.png,"shivering , clawing surrender ."
k07/k07-125/k07-125-00.png,"Not so dusty , she might say afterwards , drawing at"
k07/k07-125/k07-125-01.png,a cigarette . It 's a wow ! he said . She kissed
k07/k07-125/k07-125-02.png,him motherly : You just wait till you teach the
k07/k07-125/k07-125-03.png,girl you really love . He didn't protest any more
k07/k07-125/k07-125-04.png,to say he loved her because he knew it to
k07/k07-125/k07-125-05.png,be untrue . Instead he said : Will that be
k07/k07-125/k07-125-06.png,better ? She nodded :
k07/k07-134/k07-134-00.png,It 's man's nature to teach and to teach those
k07/k07-134/k07-134-01.png,we love is double pleasure . And she
k07/k07-134/k07-134-02.png,might add : And don't forget to leave the
k07/k07-134/k07-134-03.png,lights on . You lose half the fun when you
k07/k07-134/k07-134-04.png,fumble in the dark . She had many direct
k07/k07-134/k07-134-05.png,comments like that . Once she quietly
k07/k07-134/k07-134-06.png,pushed him back when he kissed her too
k07/k07-134/k07-134-07.png,fully and too soon :
k07/k07-141/k07-141-00.png,"Oi , not yet , you oaf . What do you think my"
k07/k07-141/k07-141-01.png,mouth is ? A billposter's bucket to be
k07/k07-141/k07-141-02.png,plunged in at random ? He 'd learned to
k07/k07-141/k07-141-03.png,laugh when something went wrong or the
k07/k07-141/k07-141-04.png,"situation became ludicrous , as when they"
k07/k07-141/k07-141-05.png,were both caught in the raw when he 'd
k07/k07-141/k07-141-06.png,forgotten to lock his door and Derek
k07/k07-141/k07-141-07.png,had walked in unexpectedly .
k07/k07-146/k07-146-00.png,They 'd just had time to nip into the
k07/k07-146/k07-146-01.png,bathroom and stood there shivering for
k07/k07-146/k07-146-02.png,fifteen minutes while their guest was
k07/k07-146/k07-146-03.png,smoking a cigarette waiting for him .
k07/k07-146/k07-146-04.png,At last Derek got tired and left .
k07/k07-146/k07-146-05.png,"Just in time , erupted Charlie . If he 'd"
k07/k07-146/k07-146-06.png,stayed any longer I 'd jolly well
k07/k07-146/k07-146-07.png,have asked him to join us . I 'm so
k07/k07-146/k07-146-08.png,darned cold I could do with two men .
k07/k07-152/k07-152-00.png,"You perverted sex-maniac , you wouldn't"
k07/k07-152/k07-152-01.png,dare . Show me what you can do and
k07/k07-152/k07-152-02.png,I 'll tell you if you need help .
k07/k07-152/k07-152-03.png,Once he came back to the subject
k07/k07-152/k07-152-04.png,of her marriage and asked her why
k07/k07-152/k07-152-05.png,she was going to marry her sculptor .
k07/k07-152/k07-152-06.png,"Because I love him , of course ."
k07/k07-152/k07-152-07.png,What do you think ?
k07/k07-158/k07-158-00.png,"But he 's a lot older , isn't he ?"
k07/k07-158/k07-158-01.png,I suppose so . What attracts you ?
k07/k07-158/k07-158-02.png,It can't be physical ? Of course
k07/k07-158/k07-158-03.png,not ! I love him for what he is
k07/k07-158/k07-158-04.png,- he 's so great I 'm a bit scared
k07/k07-158/k07-158-05.png,of him - a woman must be a bit
k07/k07-158/k07-158-06.png,scared to be really in love .
k07/k07-158/k07-158-07.png,That 's why you could never
k07/k07-158/k07-158-08.png,love me ?
k07/k07-166/k07-166-00.png,"Correct , ducky ! You just wait till"
k07/k07-166/k07-166-01.png,you meet the girl who thinks you 're a
k07/k07-166/k07-166-02.png,god . It 'll make you feel like one !
k07/k07-166/k07-166-03.png,You think that sculptor 's a god ?
k07/k07-166/k07-166-04.png,"Perhaps , in a way . All I know is"
k07/k07-166/k07-166-05.png,that I need him . He kissed the
k07/k07-166/k07-166-06.png,heart beat in her throat . But how
k07/k07-166/k07-166-07.png,about the physical side ? You 're
k07/k07-166/k07-166-08.png,quite an erotic little beast ; can
k07/k07-166/k07-166-09.png,he satisfy that ?
k07/k07-176/k07-176-00.png,You youngsters always overestimate
k07/k07-176/k07-176-01.png,yourselves . You can take it from
k07/k07-176/k07-176-02.png,me that he can and does . But
k07/k07-176/k07-176-03.png,even if he were impotent I 'd still
k07/k07-176/k07-176-04.png,love and want him . There are
k07/k07-176/k07-176-05.png,sides to me you 'll never know .
k07/k07-176/k07-176-06.png,Don't you feel guilty living with
k07/k07-176/k07-176-07.png,me ? Often ! Don't you ? Mary had
k07/k07-176/k07-176-08.png,married her bill broker some time
k07/k07-176/k07-176-09.png,ago and he now shuddered when he
k07/k07-176/k07-176-10.png,remembered the clinical weekends
k07/k07-176/k07-176-11.png,he used to spend with her .
k07/k07-185/k07-185-00.png,He often used to try to imagine
k07/k07-185/k07-185-01.png,her reactions if he had once treated
k07/k07-185/k07-185-02.png,"her as he did Charlie , but his"
k07/k07-185/k07-185-03.png,imagination failed . The efficient
k07/k07-185/k07-185-04.png,little Mary would probably have
k07/k07-185/k07-185-05.png,called it a shocking waste of time
k07/k07-185/k07-185-06.png,and told him to get down to
k07/k07-185/k07-185-07.png,"business ! Charlie , who was perfectly"
k07/k07-185/k07-185-08.png,at home at all sorts of artistic
k07/k07-185/k07-185-09.png,"circles , had amongst others wangled"
k07/k07-185/k07-185-10.png,him a membership ticket for a
k07/k07-185/k07-185-11.png,small club for artists only .
l01/l01-000/l01-000-00.png,He did well . He got in touch with
l01/l01-000/l01-000-01.png,the woman Pete was passing off as his
l01/l01-000/l01-000-02.png,mother . Starmouth managed to
l01/l01-000/l01-000-03.png,win her confidence . It seems that
l01/l01-000/l01-000-04.png,"she was an honest enough woman ,"
l01/l01-000/l01-000-05.png,only her mind wasn't as clear as
l01/l01-000/l01-000-06.png,it could have been . She showed
l01/l01-000/l01-000-07.png,him photographs . He found out
l01/l01-000/l01-000-08.png,that the name of her house - Grand
l01/l01-000/l01-000-09.png,Greve - was taken from a bay
l01/l01-000/l01-000-10.png,in one of the Channel Islands .
l01/l01-007/l01-007-00.png,"One of the small ones . Sark , that 's it . The Caxtons"
l01/l01-007/l01-007-01.png,used to have their holidays there . Starmouth went
l01/l01-007/l01-007-02.png,there . He dug out some people who remembered
l01/l01-007/l01-007-03.png,the family . In the end he pieced it all together .
l01/l01-007/l01-007-04.png,The Caxtons had two boys - Michael and Derek .
l01/l01-007/l01-007-05.png,Pete first met them at school .
l01/l01-016/l01-016-00.png,"It was a good school I sent him to , one of the best ."
l01/l01-016/l01-016-01.png,He was a boarder . He could always turn on the
l01/l01-016/l01-016-02.png,charm when it suited him . The whole family
l01/l01-016/l01-016-03.png,came to like him . The real Michael - he was the
l01/l01-016/l01-016-04.png,same age as my son - died of pleurisy when he
l01/l01-016/l01-016-05.png,was eighteen . Soon after that Pete staged his
l01/l01-016/l01-016-06.png,drowning .
l01/l01-023/l01-023-00.png,He was always a smooth liar . He invented some
l01/l01-023/l01-023-01.png,plausible story or other and threw himself on
l01/l01-023/l01-023-02.png,the Caxtons' generosity . They accepted him as a
l01/l01-023/l01-023-03.png,kind of substitute for the boy they had lost .
l01/l01-023/l01-023-04.png,Outside the family he began to pass himself
l01/l01-023/l01-023-05.png,off as Michael Caxton . The father was well-off
l01/l01-023/l01-023-06.png,and easy-going . He was easy meat for Pete .
l01/l01-030/l01-030-00.png,He sponged off him until he died
l01/l01-030/l01-030-01.png,just after the war . Then Pete had to
l01/l01-030/l01-030-02.png,look around for some other
l01/l01-030/l01-030-03.png,"security . He found it - Dackson's Wharf ,"
l01/l01-030/l01-030-04.png,and Dackson's daughter . Mrs. Caxton's
l01/l01-030/l01-030-05.png,"other boy , Derek , had been killed in the war ."
l01/l01-030/l01-030-06.png,After her husband died her brain began
l01/l01-030/l01-030-07.png,to fade . At times she thought Pete was
l01/l01-030/l01-030-08.png,really her own son .
l01/l01-050/l01-050-00.png,My chance had come at last . I had to
l01/l01-050/l01-050-01.png,take it . I was going to smash him as
